<?xml version="1.0" encoding="UTF-8"?>
<albumesMortadelo xmlns:xsi="http://www.w3.org/2001/XMLSchema-instance" xsi:noNamespaceSchemaLocation="file:///E:/Lenguajes%20de%20Marcas/Git/XML-Esquemas/ejercicio%201/ej_esq_10.xsd">
  <album fecha="1969">
    <nombre>El sulfato atómico</nombre>
  </album>
  <album fecha="1971">
    <nombre>La caja de diez cerrojos</nombre>
  </album>
  <album fecha="1973">
    <nombre>El otro yo del profesor Bacterio</nombre>
  </album>
  <album fecha="1974">
    <nombre>Los cacharros majaretas</nombre>
  </album>
</albumesMortadelo>
